{"context":{"country":"BR","flags":{"annualUpdateRequired":true,"kycLevel":2},"metrics":{"deposits":10,"totalStake":1234.56},"tags":["vip","mobile"],"userCreatedAt":"2024-01-01T00:00:00Z","userId":"u_123"},"contractVersion":"1.0","metadata":{"correlationId":"corr-0001","debug":{"clientVersion":"1.2.3","requestOrigin":"app"},"receivedAt":"2026-02-04T10:00:00Z","source":"mobile","tenant":"kto"},"ruleBundleRef":{"bundleName":"annual-update","bundleVersion":"2026-01-01"}}
